Book Id,Title,Author,Author l-f,Additional Authors,ISBN,ISBN13,My Rating,Average Rating,Publisher,Binding,Number of Pages,Year Published,Original Publication Year,Date Read,Date Added,Bookshelves,Bookshelves with positions,Exclusive Shelf,My Review,Spoiler,Private Notes,Read Count,Owned Copies
7633662,"Гаррі Поттер і в’язень Азкабану (Гаррі Поттер, #3)",J.K. Rowling,"Rowling, J.K.","Дж. К. Ролінґ, Віктор Морозов, Vladyslav Yerko, Владислав Єрко, Віктор Бариба","=""9667047369""","=""9789667047368""",5,4.58,А-БА-БА-ГА-ЛА-МА-ГА,Hardcover,384,2002,1999,2019/01/07,2019/01/13,,,read,,,,1,0
46125145,В’язні зеленої дачі,Володимир Лис,"Лис, Володимир",,"=""""","=""9786171258761""",4,3.57,Книжковий Клуб «Клуб Сімейного Дозвілля»,Hardcover,272,2019,2019,2019/06/01,2019/06/01,,,read,Історія зламаних життів.,,,1,0
7633677,"Гаррі Поттер і смертельні реліквії (Гаррі Поттер, #7)",J.K. Rowling,"Rowling, J.K.","Дж. К. Ролінґ, Віктор Морозов, Vladyslav Yerko, Владислав Єрко","=""9667047709""","=""9789667047702""",5,4.62,А-БА-БА-ГА-ЛА-МА-ГА,Hardcover,640,2007,2007,2019/05/28,2019/05/28,,,read,,,,1,0
45727020,Шовкопряд,Robert Galbraith,"Galbraith, Robert","Роберт Ґалбрейт, Наталія Ференс","=""9669482984""","=""9789669482983""",0,4.05,КМ-Букс,Hardcover,544,2019,2014,,2019/05/18,to-read,to-read (#17),to-read,,,,0,0
44577309,"Пекло (Отряд «Сигма», #14)",James Rollins,"Rollins, James","Джеймс Роллинс, Наталья Холмогорова","=""5041010153""","=""9785041010157""",4,4.20,Эксмо,Hardcover,464,2019,2019,2019/05/18,2019/05/18,,,read,,,,1,0
29356475,Чотири сезони,Stephen        King,"King, Stephen",Стівен Кінг,"=""9661492913""","=""9789661492911""",4,4.36,"Книжковий клуб ""Клуб сімейного дозвілля""",Hardcover,720,2015,1982,2017/05/12,2019/05/12,,,read,,,,1,0
22907816,Під куполом,Stephen        King,"King, Stephen","Стівен Кінг, Олександр Красюк","=""9661410259""","=""9789661410250""",5,3.93,"Книжковий Клуб ""Клуб Сімейного Дозвілля""",Hardcover,1024,2011,2009,,2017/07/02,,,read,,,,1,0
23276975,"Містер Мерседес (Bill Hodges Trilogy, #1)",Stephen        King,"King, Stephen",Олександр Красюк,"=""9661476624""","=""9789661476621""",4,4.03,Клуб сімейного дозвілля,Hardcover,544,2014,2014,,2017/07/02,,,read,,,,1,0
31927909,Куджо,Stephen        King,"King, Stephen",,"=""6171215163""","=""9786171215160""",4,3.80,Книжковий Клуб «Клуб Сімейного Дозвілля ,Hardcover,352,2016,1981,,2017/07/02,,,read,,,,1,0
35782562,Стрілець. Темна Вежа 1,Stephen        King,"King, Stephen",,"=""6171238333""","=""9786171238336""",4,3.91,Клуб сімейного дозвілля,Hardcover,240,2017,1982,,2017/07/02,,,read,,,,1,0
17694517,Несподівана вакансія,J.K. Rowling,"Rowling, J.K.","Дж. К. Ролінґ, Віктор Морозов, Тарас Малкович","=""6175850440""","=""9786175850442""",5,3.31,А-БА-БА-ГА-ЛА-МА-ГА,Hardcover,544,2013,2012,,2018/01/03,,,read,,,,1,0
20946295,Доктор Сон,Stephen        King,"King, Stephen",Стівен Кінг,"=""9661462801""","=""9789661462""",5,4.13,"Книжковий Клуб ""Клуб Сiмейного Дозвiлля"" ",Hardcover,640,2014,2013,,2018/01/03,,,read,,,,1,0
17831291,11/22/63,Stephen        King,"King, Stephen",,"=""9661434328""","=""9789661434324""",5,4.35,"Книжковий клуб ""Клуб сімейного дозвілля""",Hardcover,896,2012,2011,,2017/07/02,,,read,,,,1,0
20703458,"Сяйво (The Shining, #1)",Stephen        King,"King, Stephen","Стівен Кінг, Олександр Красюк","=""9661462798""","=""9789661462792""",4,4.28,Книжковий Клуб «Клуб Сімейного Дозвілля»,Hardcover,640,2014,1977,,2017/07/02,,,read,,,,1,0
23438073,Острів Дума,Stephen        King,"King, Stephen",,"=""9661400199""","=""9789661400190""",5,3.98,Клуб сімейного дозвілля,Hardcover,688,2008,2008,,2017/07/02,,,read,,,,1,0
31355560,"Кінець зміни (Bill Hodges Trilogy, #3)",Stephen        King,"King, Stephen",Ганна Яновська,"=""""","=""9786171215153""",4,4.11,Клуб Сімейного Дозвілля ,Hardcover,448,2016,2016,,2017/07/02,,,read,,,,1,0
28809079,Марсіянин,Andy Weir,"Weir, Andy",Віра Назаренко,"=""9669230608""","=""9789669230607""",5,4.42,КМ-Букс,Paperback,416,2015,2011,,2017/07/02,,,read,,,,1,0
45437984,"Ніж, якого не відпустиш (Chaos Walking, #1)",Patrick Ness,"Ness, Patrick","Патрік Несс, Остап Українець","=""6177660517""","=""9786177660513""",0,3.98,АССА,Hardcover,464,2019,2008,,2019/05/12,to-read,to-read (#16),to-read,,,,0,0
45450894,Рукавиця Нескінченності,Jim Starlin,"Starlin, Jim",Микита Янюк,"=""6177756026""","=""9786177756025""",0,4.12,Mal'opus,Hardcover,256,2019,1991,,2019/05/12,to-read,to-read (#15),to-read,,,,0,0
45452974,Ейнштейн. Життя і всесвіт генія,Walter Isaacson,"Isaacson, Walter","Волтер Айзексон, Микола Климчук","=""""","=""9786177552832""",0,4.17,Наш Формат,Hardcover,528,2019,2007,,2019/05/12,to-read,to-read (#14),to-read,,,,0,0
45168842,Вокзал на вулиці Відчаю,China Miéville,"Miéville, China","Чайна М'євіль, Дар'я Беззадіна, Наталія Сліпенко","=""9661059322""","=""9789661059329""",0,3.98,Навчальна книга — Богдан,Hardcover,560,2019,2000,,2019/05/05,to-read,to-read (#13),to-read,,,,0,0
7633673,"Гаррі Поттер і напівкровний Принц (Гаррі Поттер, #6)",J.K. Rowling,"Rowling, J.K.","Дж. К. Ролінґ, Віктор Морозов, Vladyslav Yerko, Владислав Єрко","=""9667047296""","=""9789667047290""",5,4.58,А-БА-БА-ГА-ЛА-МА-ГА,Hardcover,576,2006,2005,,2019/05/04,,,read,,,,2,0
45438032,Терор,Dan Simmons,"Simmons, Dan","Антон Санченко, Євгеній Стасіневич, Ден Сіммонс","=""6177585108""","=""9789662355106""",0,4.09,Видавництво Жупанського,Hardcover,672,2019,2007,,2019/05/03,to-read,to-read (#12),to-read,,,,0,0
43600702,Хранителі,Dean Koontz,"Koontz, Dean",Юрій Єфремов,"=""6171249696""","=""9786171249691""",4,4.19,Книжковий Клуб «Клуб Сімейного Дозвілля»,Hardcover,464,2019,1987,2019/04/18,2019/04/18,,,read,"Перше знайомство із Діном Кунцом пройшло добре. <br/>""Хранителі"" написані у далекому 1986 і зараз виглядають дещо ""шаблонно"" в порівнянні із книгами подібного типу останніх двох десятиліть, але це не вплинуло на отримане задоволення від прочитання роману.<br/><br/>P.S. Сподіваюся, що АУТСАЙДЕР знайде перекладача та редактора книжки і ... читайте самі, щоб зрозуміти про що я.  <br/>",,,1,0
42760916,"Кувала зозуля (Cormoran Strike, #1)",Robert Galbraith,"Galbraith, Robert","Роберт Ґалбрейт, Наталія Ференс","=""9669481252""","=""9789669481252""",4,3.89,КМ-Букс,Hardcover,512,2018,2013,2019/04/09,2019/02/11,,,read,"Міцна 4! <br/>Хороший детектив. Кажуть, що ""The devil is in the detail"". Саме так розплутує справу Корморан Страйк. <br/><br/>P.S. Навіть, якби я не знав справжнього автора цього роману, то поставив би міцну 4. ",,,1,0
36692492,Зелена миля,Stephen        King,"King, Stephen","Стівен Кінг, Олена Любенко","=""6171243019""","=""9786171243019""",5,4.49,Книжковий Клуб «Клуб Сімейного Дозвілля»,Hardcover,432,2017,1996,2019/03/29,2019/03/29,,,read,"Час забирає все, хочеш ти цього чи ні, час усе відносить геть, і зрештою залишається тільки темрява.",,,1,0
31539098,Не відпускай мене,Kazuo Ishiguro,"Ishiguro, Kazuo","Кадзуо Ішіґуро, Sofia Andrukhovych, Оксана Йориш, Назар Гайдучик","=""6176792959""","=""9786176792956""",3,3.85,Видавництво Старого Лева,Hardcover,336,2016,2005,2019/03/21,2019/03/23,,,read,,,,1,0
7633671,"Гаррі Поттер і Орден Фенікса (Гаррі Поттер, #5)",J.K. Rowling,"Rowling, J.K.","Дж. К. Ролінґ, Віктор Морозов, Vladyslav Yerko, Владислав Єрко","=""9667047423""","=""9789667047429""",5,4.50,А-БА-БА-ГА-ЛА-МА-ГА,Hardcover,816,2003,2003,2019/03/15,2019/03/15,,,read,Одна із найулюбленіших і найдраматичніших частин серії. ,,,1,0
43633573,Останній спадок,Андрій Новік,"Новік, Андрій",,"=""6171256196""","=""9786171256194""",4,3.62,Книжковий Клуб «Клуб Сімейного Дозвілля»,Hardcover,480,2019,2019,2019/02/18,2019/02/16,,,read,"Як для дебютної книжки, то, навіть, дуже непогано. <br/>Неймовірно великий виконаний шмат роботи для написання цієї книги, в кайф було читати розгадування головної загадки. <br/>Не хотілося, щоб автора називали ""українським Ден Браун""  або ""другим Кідруком"", адже щось своє у автора присутнє. <br/><br/>Не сподобалися перші 100 сторінок(в плані інтриги), я не відчув гачка, на який я б попався. Також не сподобалися останні 80 сторінок - це нагадує програміста, що розпочав масштабний проект, створив декілька гілок проекту і ... звільнився, а проект дописував джун, який перший тиждень на роботі.",,,1,0
7633666,"Гаррі Поттер і келих вогню (Гаррі Поттер, #4)",J.K. Rowling,"Rowling, J.K.","Дж. К. Ролінґ, Віктор Морозов, Sofia Andrukhovych, Софія Андрухович, Vladyslav Yerko, Владислав Єрко","=""9667047407""","=""9789667047405""",5,4.57,А-БА-БА-ГА-ЛА-МА-ГА,Hardcover,672,2003,2000,2019/03/02,2019/03/02,,,read,,,,1,0
41581806,Сплячі красуні,Stephen        King,"King, Stephen","Owen King, Олександр Красюк","=""6171254185""","=""9786171254183""",0,3.73,Книжковий Клуб «Клуб Сімейного Дозвілля»,Hardcover,880,2018,2017,,2019/02/23,to-read,to-read (#11),to-read,,,,0,0
35721986,Серця в Атлантиді,Stephen        King,"King, Stephen",,"=""6171234338""","=""9786171234338""",4,3.86,Книжковий Клуб «Клуб Сімейного Дозвілля»,Hardcover,624,2017,1999,2019/02/21,2019/02/21,,,read,,,,1,0
28380320,Мізері,Stephen        King,"King, Stephen","Стівен Кінг, Анастасія Рогоза","=""6171200794""","=""9786171200791""",4,4.23,Книжковий Клуб «Клуб Сімейного Дозвілля»,Hardcover,384,2015,1987,,2017/07/02,,,read,,,,1,0
26793121,Атлант розправив плечі. Частина третя: А є А.,Ayn Rand,"Rand, Ayn",Софія Андрухович,"=""6177279163""","=""9786177279166""",5,4.19,Наш Формат,Paperback,624,2015,1957,2019/02/14,2019/02/14,,,read,А є А<br/>Крапка,,,1,0
25970193,Атлант розправив плечі. Частина друга: Або - або,Ayn Rand,"Rand, Ayn",Софія Андрухович,"=""6177279155""","=""9786177279159""",5,4.38,Наш Формат,Paperback,472,2015,1957,2019/02/02,2019/02/10,,,read,,,,1,0
25710905,Атлант розправив плечі. Частина перша: Несуперечність,Ayn Rand,"Rand, Ayn","Айн Ренд, Артур Переверзєв, Вікторія Стах","=""6177279066""","=""9786177279067""",5,4.24,Наш Формат,Paperback,456,2015,1957,2019/01/14,2019/02/06,,,read,Під враженнями. ,,,1,0
41149762,"Історії, наклацані на друкарській машинці",Tom Hanks,"Hanks, Tom","Том Генкс, Назар Агаджанян, Назар Гайдучик","=""""","=""9786176795414""",0,3.42,Видавництво Старого Лева ,Hardcover,440,2018,2017,,2018/12/22,to-read,to-read (#9),to-read,,,,0,0
36171890,Родаки,Дмитро Кешеля,"Кешеля, Дмитро",,"=""9665805118""","=""9789665805113""",5,4.57,,Hardcover,384,2017,,2019/01/20,2019/01/20,,,read,,,,1,0
13438208,Призраки двадцатого века,Joe Hill,"Hill, Joe",,"=""5699369643""","=""9785699369645""",4,3.90,Эксмо,Hardcover,400,2009,2005,2019/01/14,2019/01/14,,,read,"Загалом сподобалося. <br/>""Добровольное заключение"" - напевно, найсильніша новела із цього збірника. Однозначно рекомендую прочитати хоча б її.<br/> ",,,1,0
7633659,"Гаррі Поттер і таємна кімната (Гаррі Поттер, #2)",J.K. Rowling,"Rowling, J.K.","Дж. К. Ролінґ, Віктор Морозов, Vladyslav Yerko, Владислав Єрко","=""9667047342""","=""9789667047344""",4,4.43,А-БА-БА-ГА-ЛА-МА-ГА,Hardcover,352,2002,1998,2019/01/05,2019/01/13,,,read,,,,1,0
34825742,"Протистояння, том 2",Stephen        King,"King, Stephen","Стівен Кінг, Сергій Крикун, Bernie Wrightson, Ганна Яновська","=""6171225401""","=""9786171225404""",5,4.31,Клуб сімейного дозвілля,Hardcover,624,2017,1978,2018/06/28,2019/01/02,,,read,,,,1,0
34605209,"Протистояння, том 1",Stephen        King,"King, Stephen","Стівен Кінг, Сергій Крикун, Ганна Яновська","=""6171224626""","=""9786171224629""",5,4.29,"Книжковий клуб ""Клуб сімейного дозвілля""",Hardcover,576,2017,1978,2018/06/14,2019/01/02,,,read,,,,1,0
32336166,"Full Wolf Moon (Jeremy Logan, #5)",Lincoln Child,"Child, Lincoln",,"=""0385531427""","=""9780385531429""",3,3.78,Doubleday,Hardcover,244,2017,2017,2018/12/31,2018/12/31,,,read,,,,1,0
9576890,Гаррі Поттер і філософський камінь,J.K. Rowling,"Rowling, J.K.","Дж. К. Ролінґ, Віктор Морозов, Vladyslav Yerko","=""9667047393""","=""9789667047399""",5,4.47,А-БА-БА-ГА-ЛА-МА-ГА,Hardcover,320,2019,1997,2018/12/22,2018/12/22,,,read,,,,1,0
31331512,Талановитий містер Ріплі,Patricia Highsmith,"Highsmith, Patricia","Патриція Гайсміт, Наталія Гоїн","=""6171215074""","=""9786171215078""",3,3.95,Клуб сімейного дозвілля,Hardcover,320,2016,1955,2018/11/25,2018/11/24,,,read,"Якось важко ""зайшла"" ця книга.",,,1,0
24935061,Поверь своим глазам,Linwood Barclay,"Barclay, Linwood","Линвуд Баркли, Игорь Моничев","=""517081674X""","=""9785170816743""",5,4.11,АСТ,Hardcover,544,2014,2012,2018/11/17,2018/11/17,,,read,"Якби міг, то поставив би цьому роману 6 зірочок. <br/>Одне задоволення читати твори цього автора. <br/>Дуже і дуже сподіваюся, що колись видадуть цю та інші його книги українською.  <br/><br/>P.S.<br/>Якщо будете читати романи цього автора, ніколи, чуєте, ніколи не вірте тому, що написано, адже Барклей/Баркли одним реченням/абзацом/параграфом зруйнує те, що ваш розум собі вже придумав. ",,,1,0
39997093,Бетмен. Книга 2: Місто сов,Scott Snyder,"Snyder, Scott","Greg Capullo, Олена Оксенич","=""9669172446""","=""9789669172440""",5,4.26,Рідна Мова,Hardcover,208,2018,2013,2018/11/08,2018/11/08,,,read,,,,1,0
37748219,Бетмен. Книга 1: Суд сов,Scott Snyder,"Snyder, Scott","Greg Capullo, Jonathan Glapion, Олени Оксенич","=""9669172039""","=""9789669172037""",5,4.34,Рідна мова,Hardcover,176,2017,2012,2018/11/02,2018/11/02,,,read,,,,1,0
38213369,Бетмен: Ноель,Lee Bermejo,"Bermejo, Lee","Лі Бермехо, Олена Оксенич","=""9669172276""","=""9789669172273""",5,4.03,Рідна мова,Hardcover,112,2018,2011,2018/11/01,2018/11/01,,,read,"4 за історію,  <br/>5 за малюнки!",,,1,0
24997498,"Максим Оса (Maxym Osa, #1-2)",Igor Baranko,"Baranko, Igor",Безосібний,"=""""","=""""",5,4.57,Євгеніос,Paperback,96,2011,2008,2018/10/26,2018/10/26,,,read,"Я б прочитав повноцінний детектив за мотивами цього коміксу, навіть незважаючи на помилки.",,,1,0
40383570,The Sandman. Пісочний Чоловік. Книга 2: Ляльковий дім,Neil Gaiman,"Gaiman, Neil","Ніл Ґейман, Олена Оксенич","=""9669172543""","=""9789669172549""",4,4.43,Рідна Мова,Hardcover,256,2018,1990,2018/10/20,2018/10/20,,,read,,,,1,0
42111195,Cтарий Лоґан. Том 1: Берсеркер,Jeff Lemire,"Lemire, Jeff","Andrea Sorrentino, Сергій Ковальчук","=""9669780802""","=""9789669780805""",4,3.94,Fireclaw,Paperback,96,2018,2016,2018/10/16,2018/09/25,,,read,,,,1,0
37541884,The Sandman. Пісочний Чоловік. Книга 1: Прелюдії й ноктюрни,Neil Gaiman,"Gaiman, Neil","Ніл Ґейман, Олена Оксенич, Михайло Назаренко, Sam Kieth, Mike Dringenberg, Malcolm Jones III, Todd Klein","=""9669172128""","=""9789669172129""",4,4.25,Рідна Мова,Hardcover,272,2017,1988,2018/10/15,2018/10/15,,,read,,,,1,0
27539149,Огонь и сера,Douglas Preston,"Preston, Douglas",,"=""""","=""""",5,4.15,Азбука,Kindle Edition,537,2014,2004,2018/03/17,2017/07/02,,,read,,,,1,0
39874627,Аеропорт,Arthur Hailey,"Hailey, Arthur","Артур Гейлі, Volodymyr Kuch, Володимир Куч","=""6171250554""","=""9786171250550""",0,4.00,Книжковий Клуб «Клуб Сімейного Дозвілля»,Hardcover,544,2018,1968,,2018/10/10,to-read,to-read (#8),to-read,,,,0,0
36071093,"Бартімеус: Амулет Самарканда (Bartimaeus, #1)",Jonathan Stroud,"Stroud, Jonathan",Володимир Панченко,"=""6175851293""","=""9786175851296""",0,4.04,А-БА-БА-ГА-ЛА-МА-ГА,Hardcover,408,2017,2003,,2018/10/10,to-read,to-read (#7),to-read,,,,0,0
40107021,"Бартімеус: Око ґолема (Bartimaeus, #2)",Jonathan Stroud,"Stroud, Jonathan","Джонатан Страуд, Володимир Панченко, Іван Сулима","=""6175851471""","=""9786175851470""",0,4.12,А-БА-БА-ГА-ЛА-МА-ГА,Hardcover,528,2018,2004,,2018/10/10,to-read,to-read (#6),to-read,,,,0,0
40776186,Керрі,Stephen        King,"King, Stephen","Стівен Кінг, Віталій Ракуленко","=""6171251143""","=""9786171251144""",0,3.99,Книжковий Клуб «Клуб Сімейного Дозвілля»,Hardcover,224,2018,1974,,2018/10/10,to-read,to-read (#5),to-read,,,,0,0
35995738,Пульт Ґвенді,Stephen        King,"King, Stephen","Richard  Chizmar, Борис Превір","=""6171239216""","=""9786171239210""",3,3.92,Книжковий Клуб «Клуб Сімейного Дозвілля»,Hardcover,160,2017,2017,,2018/04/27,,,read,,,,1,0
38916551,Крейдяна Людина,C.J. Tudor,"Tudor, C.J.",Н.І. Гоїн,"=""6171245445""","=""9786171245440""",5,3.70,Клуб Сімейнойного Дозвілля,Hardcover,288,2018,2018,2018/04/30,2018/04/30,,,read,,,,1,0
35455818,Бетмен: Рік перший,Frank Miller,"Miller, Frank","David Mazzucchelli, Френк Міллер, Девід Маццукеллі, Олена Оксенич","=""9669171768""","=""9789669171764""",4,4.25,Рідна мова,Hardcover,152,2017,1988,2018/06/04,2018/06/04,,,read,,,,1,0
36803846,Відьма,Thomas Olde Heuvelt,"Heuvelt, Thomas Olde",,"=""6177535232""","=""9786177535231""",3,3.72,КМ-Букс,Hardcover,512,2018,2013,2018/06/15,2018/06/15,,,read,"3/5<br/>Як на першу книгу автора, то написано доволі непогано, є цікаві моменти. Але більше як 3 зірки, на мою думку,  книга не заслуговує.  Сподіваюся, що наступні книги будуть кращими.",,,1,0
25831996,Воно,Stephen        King,"King, Stephen","Стівен Кінг, Олександр Красюк, Сергій Крикун, Роман Трифонов, Михайло Каменюк","=""9661486972""","=""9789661486972""",5,4.24,Клуб Сімейного Дозвілля,Hardcover,1344,2014,1986,,2017/07/02,,,read,,,,1,0
36589315,Артеміда,Andy Weir,"Weir, Andy",,"=""6177535194""","=""9786177535194""",4,3.69,КМ-Букс,Hardcover,400,2017,2017,2018/03/27,2018/03/27,,,read,"Якщо оцінювати мої очікування від книжки, то це 2.<br/>Якщо ж оцінювати сюжет книги - то це 4.<br/><br/> <br/>",,,1,0
36380188,Гора між нами,Charles Martin,"Martin, Charles",,"=""6171238724""","=""9786171238725""",4,4.22,Клуб сімейного дозвілля,Hardcover,349,2018,2010,2018/07/14,2018/07/15,,,read,,,,1,0
36456349,Бетмен: Цить,Jeph Loeb,"Loeb, Jeph","Jim Lee, Євген Музиченко","=""9669171962""","=""9789669171962""",5,4.27,Рідна Мова,Hardcover,320,2017,2002,2018/06/16,2018/06/23,,,read,,,,1,0
33961324,Твоя перша остання брехня,Harlan Coben,"Coben, Harlan","Гарлан Кобен, Олена Оксенич","=""6171216631""","=""9786171216631""",4,3.97,Книжковий Клуб «Клуб Сімейного Дозвілля» ,Hardcover,316,2017,2016,2018/04/30,2018/04/30,,,read,,,,1,0
35170273,Бетмен: Убивчий жарт,Alan             Moore,"Moore, Alan","Brian Bolland, Алан Мур, Брайан Болланд, Євген Музиченко","=""966917175X""","=""9789669171757""",4,4.36,Рідна Мова,Hardcover,72,2017,1988,2018/06/23,2018/06/23,,,read,,,,1,0
40101317,Сімміс,Neal Stephenson,"Stephenson, Neal","Ніл Стівенсон, Остап Українець","=""9661055475""","=""9789661055475""",4,4.00,,Hardcover,688,2018,2015,2018/07/29,2018/07/29,,,read,,,,1,0
41720952,"Венец демона (Sigma Force, #13)",James Rollins,"Rollins, James","Джеймс Роллинс, Анатолий Дубовик","=""5040927800""","=""9785040927807""",4,4.21,Э,Hardcover,416,2018,2017,2018/08/04,2018/08/04,,,read,,,,1,0
38101816,Ганнібал,Thomas  Harris,"Harris, Thomas","Томас Гарріс, Анастасія Рогоза","=""6171245542""","=""9786171245549""",5,3.82,«Книжковий Клуб «Клуб Сімейного Дозвілля»,Hardcover,512,2018,1999,2018/02/21,2018/02/04,,,read,,,,1,0
36283452,Першому гравцеві приготуватися,Ernest Cline,"Cline, Ernest","Ернест Клайн, Зоряна Крижанович, Юрій Нікітюк","=""6177498965""","=""9786177498963""",5,4.23,КМ-Букс,Hardcover,520,2017,2011,2018/03/03,2018/03/03,,,read,Неймовірно крута книга.<br/><br/>В найближчому майбутньому точно буду її перечитувати.,,,1,0
36410395,Стріляй як дівчисько,Mary Jennings Hegar,"Hegar, Mary Jennings","Мері Дженнінґз Геґар, Анастасія Дудченко","=""6171239275""","=""9786171239272""",5,4.14,Книжковий Клуб «Клуб Сімейного Дозвілля»,Hardcover,256,2017,2017,2018/01/27,2018/01/27,,,read,"Напевно, одна із кращих прочитаних мною книг!",,,1,0
35423177,Зоряний пил,Neil Gaiman,"Gaiman, Neil","Ніл Ґейман, Дмитро Кушнір","=""6177498019""","=""9786177498017""",4,4.10,Видавнича група КМ-БУКС,Hardcover,240,2017,1999,2018/01/10,2018/01/11,,,read,,,,1,0
30063030,Я — легенда,Richard Matheson,"Matheson, Richard",,"=""6171208361""","=""9786171208360""",4,4.05,«Книжковий Клуб «Клуб Сімейного Дозвілля» ,Hardcover,224,2016,1954,2018/08/10,2018/08/10,,,read,,,,1,0
